TrendID,TrendName,Description,StartDate,EndDate,TrendCategory,ImpactScore,Source,PublicationDate,Notes
1,Smartphone Adoption on the Rise,Increasing smartphone usage and ownership across demographics,1/1/2020,12/31/2023,Consumer Electronics,5,Industry Report,6/1/2023,Driven by 5G network rollout and new model releases
2,Foldable Smartphone Trend,Emergence of foldable and dual-screen smartphone designs,6/1/2021,12/31/2024,Consumer Electronics,4,Tech Blog,7/15/2023,Offering new form factors and user experiences
3,Work-from-Home Laptop Demand,Surge in demand for laptops to support remote work,3/1/2020,12/31/2023,Consumer Electronics,5,Market Research,8/1/2023,Adoption of laptops for home office and education
4,Gaming Laptop Popularity,Increasing sales of high-performance gaming laptops,1/1/2019,12/31/2023,Consumer Electronics,4,Industry Analysis,6/30/2023,Driven by growth of PC gaming and esports
5,Tablet Market Stabilization,Stabilizing tablet sales after initial pandemic-driven growth,1/1/2021,12/31/2024,Consumer Electronics,3,Tech News,7/1/2023,Tablets facing competition from laptops and smartphones
6,Wireless Charging Adoption,Increasing availability and usage of wireless charging for devices,6/1/2020,12/31/2024,Consumer Electronics,4,Industry Report,8/15/2023,Convenience and compatibility across devices
7,Augmented Reality in Smartphones,Integration of AR capabilities in mainstream smartphone models,3/1/2021,12/31/2025,Consumer Electronics,4,Tech Blog,7/20/2023,Enabling new user experiences and applications
8,Smartphone Camera Advancements,Rapid improvements in smartphone camera quality and features,1/1/2019,12/31/2024,Consumer Electronics,5,Industry Analysis,6/1/2023,Driving smartphone camera wars and photo-centric usage
9,Smartphone Battery Life Improvements,Increasing battery capacity and power efficiency in smartphones,1/1/2020,12/31/2024,Consumer Electronics,4,Tech News,8/1/2023,Addressing a key pain point for mobile users
10,Smartphone Ecosystem Expansion,Growing reliance on smartphone-centric digital ecosystems,1/1/2021,12/31/2025,Consumer Electronics,5,Industry Report,7/15/2023,"Integrating services, apps, and devices around smartphones"
11,Laptop Display Quality Enhancements,Improved display technologies and resolutions in laptops,6/1/2020,12/31/2024,Consumer Electronics,4,Tech Blog,8/1/2023,Catering to visual demands of content creation and gaming
12,Laptop Sustainability Initiatives,Increased focus on eco-friendly and sustainable laptop designs,1/1/2021,12/31/2025,Consumer Electronics,4,Industry Analysis,7/1/2023,Reducing environmental impact of laptop production and use
13,Laptop Performance Advancements,Significant CPU and GPU improvements in laptop hardware,6/1/2019,12/31/2023,Consumer Electronics,5,Tech News,6/15/2023,"Enabling better multitasking, content creation, and gaming"
14,Laptop Convertible and 2-in-1 Trend,Growing popularity of laptop-tablet hybrid devices,3/1/2020,12/31/2024,Consumer Electronics,4,Industry Report,7/30/2023,Offering versatility and mobility for users
15,Tablet Adoption in Education,Increasing use of tablets for digital learning and classroom use,1/1/2021,12/31/2025,Consumer Electronics,4,Tech Blog,8/1/2023,Enabling interactive and personalized learning experiences
16,Tablet Productivity Enhancements,Improvements in tablet software and accessories for productivity,6/1/2020,12/31/2024,Consumer Electronics,4,Industry Analysis,7/15/2023,Bridging the gap between tablets and laptops
17,Tablet Penetration in Enterprise,Adoption of tablets for mobile productivity and field applications,1/1/2021,12/31/2025,Consumer Electronics,4,Tech News,8/1/2023,Providing a balance of mobility and functionality
18,Tablet Market Segmentation,Diversification of tablet models targeting different user segments,6/1/2019,12/31/2023,Consumer Electronics,3,Industry Report,7/1/2023,"Addressing the needs of consumers, businesses, and niche users"
19,Smartphone Camera AI and Computational Photography,Advancements in AI-powered computational photography on smartphones,1/1/2020,12/31/2024,Consumer Electronics,5,Tech Blog,7/15/2023,Enabling professional-grade photography features on mobile devices
20,Smartphone Biometrics and Security,Increased integration of biometric authentication on smartphones,1/1/2021,12/31/2025,Consumer Electronics,4,Industry Analysis,8/1/2023,Improving security and user convenience
21,Smartphone Sustainability and Repairability,Growing demand for more sustainable and repairable smartphones,6/1/2021,12/31/2025,Consumer Electronics,4,Tech News,7/1/2023,Addressing environmental concerns and extending device lifespans
22,Smartphone Supply Chain Challenges,Disruptions and constraints in the global smartphone supply chain,3/1/2020,12/31/2023,Consumer Electronics,5,Industry Report,6/15/2023,Impacting smartphone availability and pricing
23,Smartphone 5G Adoption,Rollout of 5G networks and increasing 5G-enabled smartphone models,6/1/2020,12/31/2025,Consumer Electronics,5,Tech Blog,7/20/2023,Unlocking new capabilities and use cases for mobile devices
24,Smartphone Personalization and Customization,Growing demand for personalized and customizable smartphone experiences,1/1/2021,12/31/2025,Consumer Electronics,4,Industry Analysis,8/1/2023,Enabling users to tailor their devices to their preferences
25,Smartphone Software and Ecosystem Lock-in,Increasing user reliance on smartphone-centric digital ecosystems,1/1/2020,12/31/2024,Consumer Electronics,4,Tech News,7/1/2023,Strengthening platform loyalty and user retention
26,Smartphone Affordability and Value Offerings,Emergence of more affordable and value-focused smartphone models,6/1/2021,12/31/2025,Consumer Electronics,5,Industry Report,6/30/2023,Expanding smartphone access to wider consumer segments
27,Smartphone Trade-in and Resale Market,Growth of secondary market for used and refurbished smartphones,3/1/2020,12/31/2024,Consumer Electronics,4,Tech Blog,7/15/2023,Enabling more sustainable device lifecycles and accessibility
28,Smartphone Subscription and Leasing Models,Increasing adoption of smartphone subscription and leasing programs,1/1/2021,12/31/2025,Consumer Electronics,4,Industry Analysis,8/1/2023,Providing more flexible and cost-effective smartphone ownership options
29,Smartphone Camera Dual/Triple/Quad Lens Trend,Proliferation of multi-lens camera systems in smartphones,6/1/2019,12/31/2023,Consumer Electronics,5,Tech News,7/1/2023,Enabling advanced photographic capabilities on mobile devices
30,Smartphone Display Advancements,"Improvements in smartphone display technologies, resolutions, and form factors",1/1/2020,12/31/2024,Consumer Electronics,4,Industry Report,6/15/2023,Enhancing visual experiences and supporting new use cases
31,Smartphone Battery Life and Charging Innovation,"Advancements in smartphone battery capacity, efficiency, and fast charging",6/1/2020,12/31/2024,Consumer Electronics,5,Tech Blog,7/20/2023,Addressing a key pain point and enabling all-day usage
32,5G Smartphone Adoption,Rapid growth in 5G-enabled smartphone sales,1/1/2020,12/31/2024,Consumer Electronics,5,Industry Report,5/1/2023,Driven by 5G network rollout and new model releases
33,Foldable Phone Innovations,Emergence of advanced foldable and dual-screen smartphone designs,6/1/2021,12/31/2024,Consumer Electronics,4,Tech Blog,7/15/2023,Offering new form factors and user experiences
34,Work-from-Home Laptop Demand,Surge in demand for laptops to support remote work and education,3/1/2020,12/31/2023,Consumer Electronics,5,Market Research,8/1/2023,Accelerated by the COVID-19 pandemic
35,Gaming Laptop Popularity,Increasing sales of high-performance gaming laptops,1/1/2019,12/31/2023,Consumer Electronics,4,Industry Analysis,6/30/2023,Driven by growth of PC gaming and esports
36,Smartphone Camera Advancements,"Improvements in smartphone camera quality, features, and computational photography",1/1/2020,12/31/2024,Consumer Electronics,5,Tech Review,9/1/2023,Enabling more professional-grade mobile photography
37,Sustainable Electronics Trends,Growing consumer demand for eco-friendly and energy-efficient electronics,1/1/2021,12/31/2024,Consumer Electronics,4,Industry Report,8/15/2023,Driven by environmental consciousness and regulations
38,Wireless Charging Adoption,Increasing popularity of wireless charging solutions for smartphones and other devices,6/1/2020,12/31/2024,Consumer Electronics,4,Tech Blog,7/20/2023,Improving convenience and reducing cable clutter
39,Augmented Reality in Smartphones,Integration of AR capabilities into mainstream smartphone models,1/1/2021,12/31/2024,Consumer Electronics,4,Tech Review,10/1/2023,Supporting new use cases and immersive experiences
40,Smartphone Screen Size Trends,Increasing adoption of larger smartphone displays and foldable form factors,1/1/2020,12/31/2024,Consumer Electronics,4,Industry Analysis,9/15/2023,Driven by consumer demand for more immersive experiences
41,Laptop Convertible/Hybrid Designs,Growing popularity of 2-in-1 laptop and tablet hybrid devices,6/1/2019,12/31/2023,Consumer Electronics,4,Market Research,7/1/2023,Offering increased flexibility and mobility for users
42,Smartphone AI Capabilities,Advancements in on-device AI for improved user experiences,1/1/2021,12/31/2024,Consumer Electronics,4,Tech Review,11/1/2023,Enabling smarter digital assistants and computer vision features
43,Smartphone Sustainability Initiatives,Increased focus on eco-friendly materials and circular economy for smartphones,1/1/2022,12/31/2024,Consumer Electronics,4,Industry Report,8/20/2023,Driven by consumer demand and regulatory pressures
44,Laptop Performance and Portability,Balancing high-performance and lightweight designs in laptops,1/1/2020,12/31/2024,Consumer Electronics,4,Industry Analysis,9/10/2023,Meeting the needs of both productivity and mobility-focused users
45,Smartphone Biometric Security,Adoption of advanced biometric authentication like in-display fingerprint and face recognition,6/1/2020,12/31/2024,Consumer Electronics,4,Tech Blog,10/5/2023,Improving security and user convenience
46,Laptop Displays with Higher Refresh Rates,Increasing availability of laptops with 120Hz and 144Hz display options,1/1/2021,12/31/2024,Consumer Electronics,4,Tech Review,11/15/2023,Enhancing smoothness and responsiveness for gaming and content creation
47,Smartphone Camera Zoom Capabilities,Advancements in optical and digital zoom for smartphone cameras,1/1/2020,12/31/2024,Consumer Electronics,4,Industry Report,12/1/2023,Enabling higher quality and versatile mobile photography
48,Laptop Battery Life Improvements,Longer battery runtimes for laptops through advancements in battery tech and power management,6/1/2020,12/31/2024,Consumer Electronics,4,Market Research,8/25/2023,Addressing a key need for both productivity and mobility
49,Smartphone Modularity and Repairability,Increased focus on modular and repairable smartphone designs,1/1/2022,12/31/2024,Consumer Electronics,3,Industry Analysis,9/30/2023,Driven by sustainability and right-to-repair initiatives
50,Laptop Cellular Connectivity,Laptops with integrated 5G and LTE cellular connectivity for untethered mobile productivity,1/1/2021,12/31/2024,Consumer Electronics,4,Tech Blog,10/20/2023,Enabling always-connected experiences for remote work and learning
